{
  "event_name": "mastery.competency_state_changed",
  "event_schema_version": 1,
  "workspace_id": "10000000-0000-4000-8000-000000000001",
  "payload": {
    "competency_ref": "competency:aaaaaaaaaaaaaaaaaaaaaaaaaaaaaaaaaaaaaaaaaaaaaaaaaaaaaaaaaaaaaaaaaaaaaaaaaaaaaaaaaaaaaaaaaaaaaaaaaaaaa",
    "snapshot_id": "20000000-0000-4000-8000-000000000001",
    "projection_generation": "live-v1",
    "input_watermark": "9223372036854775807",
    "achievement_level": "MASTERED",
    "engine_version": "mastery-engine/0.1.0",
    "policy_version": "mastery-readiness-policy/0.1",
    "calculated_as_of": "9999-12-31T23:59:59.999Z"
  }
}
